{"$schema":"https://json-schema.org/draft/2020-12/schema","$id":"https://abvx.invalid/schemas/mission-state-export/v1","title":"ABVX Normalized Mission State Export","type":"object","additionalProperties":false,"required":["schema_version","mission_id","objective","status","work_state","gates","retry","evidence_refs","quota","waiting_for_human","terminal","revision"],"properties":{"schema_version":{"const":"v1"},"mission_id":{"type":"string","minLength":1},"objective":{"type":"string"},"status":{"enum":["new","active","waiting_for_human","completed","rejected"]},"work_state":{"type":"object"},"gates":{"type":"array","items":{"type":"object","additionalProperties":false,"required":["id","status"],"properties":{"id":{"type":"string"},"status":{"enum":["open","approved","rejected"]},"decision":{"type":["string","null"]}}}},"retry":{"type":"object","additionalProperties":false,"required":["attempt","max_retries"],"properties":{"attempt":{"type":"integer","minimum":0},"max_retries":{"type":"integer","minimum":0}}},"evidence_refs":{"type":"array","items":{"type":"string"}},"quota":{"type":"object"},"waiting_for_human":{"type":"boolean"},"terminal":{"type":"boolean"},"revision":{"type":"integer","minimum":0}}}
